region,score,breakdown,motivation,avg_cost_night,airport,airport_km,description
Yunnan,100,"{'interests': '40/40 - matches: backpacker', 'budget': '20/20 - perfect match', 'climate': '25/25 - great temp (21.1°C)', 'company': '15/15 - great for friend group'}",Yunnan looks like a great match for your travel style!,30,KMG,15,"Mountains, ethnic villages and the famous Tiger Leaping Gorge."
Guilin,100,"{'interests': '40/40 - matches: backpacker', 'budget': '20/20 - perfect match', 'climate': '25/25 - great temp (26.5°C)', 'company': '15/15 - great for friend group'}",Guilin looks like a great match for your travel style!,35,KWL,28,Karst peaks and the Li River — one of China's most scenic regions.
Beijing,50,"{'interests': '0/40 - no overlap', 'budget': '10/20 - close match', 'climate': '25/25 - great temp (26.7°C)', 'company': '15/15 - great for friend group'}",Beijing looks like a great match for your travel style!,80,PEK,25,Ancient capital with the Great Wall and Forbidden City.
Sichuan,50,"{'interests': '0/40 - no overlap', 'budget': '10/20 - close match', 'climate': '25/25 - great temp (26.2°C)', 'company': '15/15 - great for friend group'}",Sichuan looks like a great match for your travel style!,50,CTU,16,"Giant pandas, spicy hotpot and sacred Buddhist mountains."
Xian,43,"{'interests': '0/40 - no overlap', 'budget': '10/20 - close match', 'climate': '25/25 - great temp (24.9°C)', 'company': '8/15 - ok for friend group'}",Xian looks like a great match for your travel style!,55,XIY,47,Silk Road city famous for the Terracotta Army and Muslim Quarter food.
